{
  "schema_version": 1,
  "id": "ink_fantasy",
  "label": "Ink Fantasy",
  "reference_mode": "text_style",
  "style_prompt": "hand-inked fantasy RPG interface, parchment darkened with ink wash, jade and muted red accents, readable frame ornaments, no text baked into assets",
  "negative_prompt": "photorealism, modern sci-fi neon, watermark, logo, unreadable text, character portrait",
  "output_contract": {
    "format": "png",
    "transparent_background": true,
    "safe_border_px": 10,
    "naming": "{style_id}_{slot_id}.png"
  }
}
