{
  "schema_version": 1,
  "id": "kenney_rpg",
  "label": "Kenney RPG UI",
  "reference_mode": "external_asset_pack",
  "style_prompt": "clean fantasy RPG game UI using Kenney CC0 assets, beveled parchment panels, readable long buttons, simple status bars, no baked text",
  "negative_prompt": "photorealism, noisy grunge, unreadable text, characters, logo, watermark",
  "output_contract": {
    "format": "png",
    "transparent_background": true,
    "safe_border_px": 4,
    "naming": "kenney_{slot_id}.png"
  },
  "source": {
    "type": "external_asset_pack",
    "manifest": "res://ui_pipeline/import_manifests/kenney_rpg.json",
    "licenses": [
      "CC0-1.0"
    ]
  }
}
