{
  "schema_version": 1,
  "id": "kenney_modern_ui",
  "label": "Kenney Modern UI",
  "reference_mode": "external_asset_pack",
  "style_prompt": "compact modern game UI using Kenney CC0 assets, clean blue controls, slider bars, square icon frames, no baked text",
  "negative_prompt": "photorealism, noisy grunge, unreadable text, characters, logo, watermark",
  "output_contract": {
    "format": "png",
    "transparent_background": true,
    "safe_border_px": 4,
    "naming": "kenney_modern_{slot_id}.png"
  },
  "source": {
    "type": "external_asset_pack",
    "manifest": "res://ui_pipeline/import_manifests/kenney_modern_ui.json",
    "licenses": [
      "CC0-1.0"
    ]
  }
}
